{
  "$schema": "https://json-schema.org/draft/2020-12/schema",
  "$id": "https://schemas.ubunow.net/phase1/core/universe-state.schema.json",
  "title": "Universe State",
  "type": "object",
  "description": "Canonical Phase 1 UniverseState facts container for planning or API exchange, represented as four open fact collections, an optional per-target fact_provenance map, and source and confidence summaries.",
  "additionalProperties": false,
  "properties": {
    "id": {
      "$ref": "https://schemas.ubunow.net/phase1/common/id.schema.json"
    },
    "captured_at": {
      "$ref": "https://schemas.ubunow.net/phase1/common/timestamp.schema.json"
    },
    "facts": {
      "type": "object",
      "description": "Open map of namespaced dotted fact keys to arbitrary JSON values.",
      "propertyNames": {
        "type": "string",
        "pattern": "^[A-Za-z0-9_-]+(\\.[A-Za-z0-9_-]+)+$"
      },
      "additionalProperties": true
    },
    "numeric_values": {
      "type": "object",
      "description": "Open map of namespaced dotted numeric keys to number values.",
      "propertyNames": {
        "type": "string",
        "pattern": "^[A-Za-z0-9_-]+(\\.[A-Za-z0-9_-]+)+$"
      },
      "additionalProperties": {
        "type": "number"
      }
    },
    "set_memberships": {
      "type": "object",
      "description": "Open map of namespaced dotted set keys to arrays of JSON scalar members.",
      "propertyNames": {
        "type": "string",
        "pattern": "^[A-Za-z0-9_-]+(\\.[A-Za-z0-9_-]+)+$"
      },
      "additionalProperties": {
        "type": "array",
        "items": {
          "type": [
            "string",
            "number",
            "boolean",
            "null"
          ]
        }
      }
    },
    "event_markers": {
      "type": "object",
      "description": "Open map of namespaced dotted event keys to arrays of loosely typed marker objects.",
      "propertyNames": {
        "type": "string",
        "pattern": "^[A-Za-z0-9_-]+(\\.[A-Za-z0-9_-]+)+$"
      },
      "additionalProperties": {
        "type": "array",
        "items": {
          "type": "object",
          "additionalProperties": true
        }
      }
    },
    "fact_provenance": {
      "type": "object",
      "description": "Optional map from a full target, a collection name and then its dotted key, to how the value at that target was established and when. A target with no entry has no recorded provenance. An entry is removed with its value. It is not named provenance because a stored UniverseState payload already carries the object envelope under that key.",
      "propertyNames": {
        "type": "string",
        "pattern": "^(facts|numeric_values|set_memberships|event_markers)\\.[A-Za-z0-9_-]+(\\.[A-Za-z0-9_-]+)*$"
      },
      "additionalProperties": {
        "type": "object",
        "description": "How one value was established, and when. Deliberately nothing else: no confidence number and no free text.",
        "additionalProperties": false,
        "properties": {
          "kind": {
            "type": "string",
            "description": "asserted: a person said so. measured: an instrument or a reading. derived: computed from other facts. proposed: an advisor suggested it and it has not been confirmed.",
            "enum": [
              "asserted",
              "measured",
              "derived",
              "proposed"
            ]
          },
          "recorded_at": {
            "$ref": "https://schemas.ubunow.net/phase1/common/timestamp.schema.json"
          }
        },
        "required": [
          "kind",
          "recorded_at"
        ]
      }
    },
    "source_summary": {
      "type": "string",
      "minLength": 1
    },
    "confidence_summary": {
      "type": [
        "string",
        "null"
      ]
    }
  },
  "required": [
    "id",
    "captured_at",
    "facts",
    "numeric_values",
    "set_memberships",
    "event_markers",
    "source_summary"
  ]
}
