{
  "id": "ustate_018f3c8e9b2a7c4d8f1e2a3b4c5d6e80",
  "captured_at": "2026-06-22T14:30:00Z",
  "facts": {
    "greenhouse.vent.propped": true,
    "greenhouse.bench.label": "north"
  },
  "numeric_values": {
    "greenhouse.bench.seed_trays": 12.0,
    "greenhouse.vent.opening_degrees": 37.5
  },
  "set_memberships": {
    "greenhouse.tools": [
      "dibber",
      "trowel"
    ]
  },
  "event_markers": {
    "greenhouse.vent.opened": [
      {
        "by": "invented lever"
      }
    ]
  },
  "fact_provenance": {
    "facts.greenhouse.vent.propped": {
      "kind": "asserted",
      "recorded_at": "2026-06-22T14:31:00Z"
    },
    "numeric_values.greenhouse.vent.opening_degrees": {
      "kind": "measured",
      "recorded_at": "2026-06-22T14:32:00Z"
    },
    "numeric_values.greenhouse.bench.seed_trays": {
      "kind": "derived",
      "recorded_at": "2026-06-22T14:33:00Z"
    },
    "set_memberships.greenhouse.tools": {
      "kind": "proposed",
      "recorded_at": "2026-06-22T14:34:00.25Z"
    }
  },
  "source_summary": "Synthetic accepted inputs for the fixture state",
  "confidence_summary": "Synthetic fixture confidence summary"
}
